,Sentence,Content Bias,Partisan Bias,False balance,Ventriloquism,Demographic bias,Undue Weight,Corporate
0,"The president's speech yesterday was an absolute disaster, revealing his incompetence.",1.0,1.0,0.0,0.0,0.0,0.0,0.0
1,"Climate change is a controversial issue, with some scientists arguing that it is a hoax.",0.0,0.0,1.0,0.0,0.0,0.0,0.0
2,"In a groundbreaking move, the company announced a 50% increase in wages for female employees.",0.0,0.0,0.0,0.0,1.0,0.0,1.0
3,"Despite widespread opposition, the oil company has received government support to continue drilling in protected areas.",1.0,0.0,0.0,0.0,0.0,1.0,1.0
4,The senator's recent tweet demonstrates her unwavering commitment to social justice.,0.0,1.0,0.0,0.0,0.0,0.0,0.0
5,Our city's homeless crisis is due to the lack of affordable housing and the mayor's poor leadership.,1.0,1.0,0.0,0.0,0.0,0.0,0.0
6,"According to an anonymous source, the candidate has been involved in illicit activities.",0.0,0.0,0.0,1.0,0.0,0.0,0.0
7,"Over the past decade, tech companies have been unfairly targeting conservatives on social media platforms.",1.0,1.0,0.0,0.0,0.0,1.0,1.0
8,Researchers have found that eating chocolate may actually help you lose weight.,0.0,0.0,0.0,0.0,0.0,1.0,0.0
9,The new law disproportionately affects low-income communities and people of color.,0.0,0.0,0.0,0.0,1.0,0.0,0.0
10,"Many celebrities have endorsed the new weight-loss pill, claiming it's a miracle solution.",0.0,0.0,0.0,0.0,0.0,1.0,1.0
11,"Last week's hurricane left thousands without power, but the government's response was swift and efficient.",0.0,0.0,0.0,0.0,0.0,0.0,0.0
12,"Foreign countries are taking advantage of our weak trade policies, leaving our economy in shambles.",1.0,1.0,0.0,0.0,0.0,0.0,0.0
13,"Both parties are to blame for the gridlock in Congress, making it impossible to pass meaningful legislation.",0.0,1.0,1.0,0.0,0.0,0.0,0.0
14,"The pharmaceutical company has raised the price of life-saving medication by 500%, leaving patients in dire need.",0.0,0.0,0.0,0.0,0.0,1.0,1.0
15,"Proponents of the controversial policy argue that it is necessary for national security, while critics say it's a violation of civil liberties.",0.0,0.0,1.0,0.0,0.0,0.0,0.0
16,"The local community gathered together to clean up the park, showing a true sense of unity.",0.0,0.0,0.0,0.0,0.0,0.0,0.0
17,"Despite the scientific consensus, some still believe that vaccines cause autism.",0.0,0.0,1.0,0.0,0.0,1.0,0.0
18,"The wealthy elite continue to exploit tax loopholes, further widening the income gap.",1.0,0.0,0.0,0.0,1.0,0.0,0.0
19,"According to a company spokesperson, the decision to lay off employees was difficult but necessary.",0.0,0.0,0.0,1.0,0.0,0.0,1.0
20,"The president's recent visit to the affected area was nothing short of a publicity stunt, as he made no real effort to address the pressing issues faced by the community and only focused on photo opportunities with local residents.",1.0,1.0,0.0,0.0,0.0,0.0,0.0
21,"Although the majority of scientists agree that climate change is a significant issue caused by human activities, there are a few who argue that the Earth's climate has always experienced natural fluctuations, and the current warming trend is simply part of that cycle.",0.0,0.0,1.0,0.0,0.0,0.0,0.0
22,"In an unprecedented move, the multinational corporation announced a comprehensive diversity initiative, which includes a 50% increase in wages for female employees, targeted recruitment efforts to attract underrepresented groups, and the establishment of an internal task force to address systemic biases.",0.0,0.0,0.0,0.0,1.0,0.0,1.0
23,"Local residents have expressed concern about the proposed development project, citing potential environmental impacts, the displacement of low-income families, and the undue influence of corporate interests on the city council's decision-making process.",1.0,0.0,0.0,0.0,1.0,1.0,1.0
24,"Prominent political analysts and commentators from both sides of the aisle have been criticizing the government's handling of the crisis, with some accusing the administration of incompetence and others suggesting that the response has been marred by partisan bickering and political posturing.",1.0,1.0,1.0,0.0,0.0,0.0,0.0
25,"According to an anonymous source who claims to have inside information, the popular tech entrepreneur is secretly involved in a number of shady business dealings, raising questions about the integrity and ethics of his highly-publicized philanthropic endeavors.",0.0,0.0,0.0,1.0,0.0,0.0,1.0
26,"The recent string of natural disasters has left countless individuals displaced and struggling to rebuild their lives, and while some have praised the government's relief efforts, others argue that these devastating events have disproportionately affected marginalized communities, who receive far less support and resources.",0.0,0.0,0.0,0.0,1.0,0.0,0.0
27,"Renowned celebrities and public figures have been touting the purported benefits of the latest health and wellness craze, with some attributing their dramatic weight loss and improved vitality to the mysterious, yet-to-be-released product, which they claim is backed by groundbreaking scientific research.",0.0,0.0,0.0,0.0,0.0,1.0,1.0
28,"The ongoing debate surrounding immigration policy has once again come to the forefront, as supporters of the new legislation argue that it is a necessary step in addressing the issue of illegal immigration and protecting the nation's borders, while opponents claim that it unfairly targets individuals from specific countries and perpetuates harmful stereotypes.",0.0,0.0,1.0,0.0,1.0,0.0,0.0
29,"Many working-class families have been struggling to make ends meet due to stagnant wages and the increasing cost of living, but some politicians and media outlets continue to blame the issue on frivolous spending habits and a lack of personal responsibility, rather than addressing the systemic factors contributing to income inequality.",1.0,1.0,0.0,0.0,1.0,0.0,0.0
30,"In response to the alarming rise in teen vaping rates, the e-cigarette manufacturer has announced a series of new measures aimed at curbing the use of their products among minors, including updated packaging with more prominent health warnings, stricter age verification processes for online sales, and the discontinuation of certain popular flavors that have been criticized for appealing to young people.",0.0,0.0,0.0,0.0,0.0,1.0,1.0
31,"The international community has expressed growing concern about the escalating conflict in the region, with some calling for a diplomatic resolution and the imposition of sanctions, while others argue that military intervention may be necessary to prevent further violence and protect the innocent civilians caught in the cross fire.",0.0,0.0,1.0,0.0,0.0,0.0,0.0
32,"Despite the well-documented benefits of a plant-based diet, some still argue that humans are naturally meant to consume meat and that abstaining from animal products can lead to nutritional deficiencies.",0.0,0.0,1.0,0.0,0.0,0.0,0.0
33,"Numerous studies have shown that early childhood education is crucial for cognitive and emotional development, but funding for these programs continues to be a contentious issue, as some policymakers argue that resources should be allocated to other areas, such as defense or infrastructure.",1.0,1.0,0.0,0.0,0.0,0.0,0.0
34,"A new app claims to revolutionize the dating scene by using complex algorithms and data analysis to find users their perfect match, but critics argue that the reliance on technology devalues the human element of forming relationships and may perpetuate harmful biases.",0.0,0.0,0.0,0.0,1.0,1.0,1.0
35,"Rapid advancements in artificial intelligence have sparked a debate about the potential consequences of increasingly autonomous machines, with some experts warning that unchecked development could lead to widespread unemployment or even pose an existential threat to humanity.",0.0,0.0,0.0,0.0,0.0,1.0,0.0
36,"Last night, the city council unanimously approved the construction of a new affordable housing complex, a decision that was met with applause from advocates for low-income families.",0.0,0.0,0.0,0.0,1.0,0.0,0.0
37,"The controversial new book has generated heated discussions about the role of race and identity in contemporary society, with some accusing the author of perpetuating divisive narratives, while others praise their unflinching examination of systemic inequality.",1.0,1.0,1.0,0.0,1.0,0.0,0.0
38,"An anonymous whistleblower has accused the pharmaceutical company of price gouging, alleging that the cost of life-saving medication has skyrocketed in recent years, while executive salaries and bonuses have continued to increase.",0.0,0.0,0.0,1.0,0.0,1.0,1.0
39,"Proponents of the proposed tax reform claim that it will stimulate economic growth and benefit all citizens, while detractors argue that the changes disproportionately favor the wealthy and will exacerbate income inequality.",0.0,0.0,1.0,0.0,1.0,0.0,0.0
40,"The community center is hosting a free job fair this weekend, featuring local employers and workshops on resume writing and interview techniques.",0.0,0.0,0.0,0.0,0.0,0.0,0.0
41,"Recent reports suggest that the internet giant has been secretly tracking users' online activity, even when privacy settings are enabled, raising questions about the company's commitment to consumer privacy and the ethics of data collection.",1.0,0.0,0.0,0.0,0.0,1.0,1.0
42,"In a historic ruling, the Supreme Court has declared that the controversial policy is unconstitutional, stating that it infringes upon the fundamental rights and freedoms of citizens.",0.0,0.0,0.0,0.0,0.0,0.0,0.0
43,"Despite the growing consensus among medical professionals about the importance of mental health care, access to affordable services remains limited, particularly for individuals living in rural areas or those without insurance coverage.",1.0,0.0,0.0,0.0,1.0,0.0,0.0
44,"Environmental activists have accused the logging company of contributing to deforestation and the loss of biodiversity, while the company's CEO insists that their operations are sustainable and adhere to strict environmental standards.",1.0,0.0,0.0,0.0,0.0,1.0,1.0
45,"Both major political parties have been implicated in a wide-ranging corruption scandal, casting doubt on the integrity of the nation's democratic institutions and fueling public distrust in elected officials.",0.0,1.0,0.0,0.0,0.0,0.0,0.0
46,"Local farmers are struggling to cope with the devastating effects of the ongoing drought, which has been exacerbated by climate change and unsustainable agricultural practices.",1.0,0.0,0.0,0.0,0.0,0.0,0.0
47,"Several popular social media influencers have endorsed a new line of eco-friendly products, but critics argue that the promotion is a thinly veiled marketing campaign designed to boost sales rather than genuinely advocate for environmental responsibility.",0.0,0.0,0.0,0.0,0.0,1.0,1.0
48,"Government officials announced today that they will be investing in a nationwide initiative to provide free, high-speed internet access to all citizens, bridging the digital divide and ensuring equal access to information and resources.",0.0,0.0,0.0,0.0,1.0,0.0,0.0
49,"The recent election has exposed deep divisions within the country, with some arguing that the polarized political climate has been fueled by sensationalist media coverage and a lack of nuanced, balanced reporting.",1.0,1.0,1.0,0.0,0.0,0.0,0.0
50,"A groundbreaking study has found a link between air pollution and cognitive decline, prompting calls for stricter regulations on industrial emissions and greater investment in clean energy technologies.",0.0,0.0,0.0,0.0,0.0,0.0,0.0
51,"Opponents of the new healthcare legislation argue that it will lead to a decline in the quality of care and restrict patient choice, while supporters maintain that it is a necessary step in ensuring access to affordable healthcare for all citizens.",0.0,0.0,1.0,0.0,0.0,0.0,0.0
52,"The latest blockbuster film has been praised for its diverse cast and inclusive representation, but some critics argue that the movie still relies on outdated stereotypes and fails to authentically portray the experiences of marginalized communities.",1.0,0.0,0.0,0.0,1.0,0.0,1.0
53,"Allegations of misconduct within the organization have prompted a wave of resignations and calls for increased transparency, but an anonymous source claims that the situation is being manipulated by external forces with a vested interest in the group's demise.",0.0,0.0,0.0,1.0,0.0,1.0,0.0
54,"Major tech companies have faced criticism for their role in facilitating the spread of misinformation and polarizing content, with some arguing that their algorithms prioritize engagement over accuracy and ultimately undermine the democratic process.",1.0,0.0,0.0,0.0,0.0,1.0,1.0
55,"Despite widespread concerns about the potential health risks associated with genetically modified organisms, many experts argue that GMOs are a safe and necessary tool in the fight against global hunger and malnutrition.",0.0,0.0,1.0,0.0,0.0,0.0,0.0
56,"The release of the highly anticipated smartphone has been marred by reports of poor working conditions and labor abuses at the company's overseas factories, sparking calls for increased corporate accountability and ethical manufacturing practices.",1.0,0.0,0.0,0.0,1.0,0.0,1.0
57,"Many attribute the recent rise in violent crime to the decline of traditional family values and a lack of respect for authority, while others argue that the issue is far more complex and can be traced back to factors such as poverty, systemic inequality, and inadequate social services.",1.0,1.0,0.0,0.0,1.0,0.0,0.0
58,"Local volunteers are working together to build a community garden in an effort to promote sustainable living, healthy eating, and a greater sense of connection among neighbors.",0.0,0.0,0.0,0.0,0.0,0.0,0.0
59,"The proposed merger between the two major corporations has sparked concerns about the potential impact on market competition and consumer choice, with some calling for greater regulatory oversight to prevent the formation of monopolies.",0.0,0.0,0.0,0.0,0.0,1.0,1.0
60,"Protests have erupted across the country in response to the controversial court ruling, with demonstrators demanding justice and an end to systemic bias within the legal system.",0.0,0.0,0.0,0.0,1.0,0.0,0.0
61,The economic crisis is deepening in the United States,0.0,0.0,0.0,0.0,0.0,0.0,0.0
62,The president of the United States has issued orders to increase the minimum wage,0.0,0.0,0.0,0.0,0.0,0.0,0.0
63,The Trump administration has been blamed for the economic crisis in the United States,0.0,1.0,0.0,0.0,0.0,0.0,0.0
64,The Democrats have caused the economic crisis in the United States,0.0,1.0,1.0,0.0,0.0,0.0,0.0
65,The United States is facing an economic downturn due to the policies of the Republican Party,0.0,1.0,0.0,0.0,0.0,0.0,0.0
66,The coronavirus pandemic has had a significant economic impact on the United States,0.0,0.0,0.0,0.0,0.0,0.0,0.0
67,The government should provide economic relief to those affected by the coronavirus,0.0,0.0,0.0,0.0,0.0,0.0,0.0
68,The Republican Party has been accused of using the coronavirus pandemic to advance their political agenda,0.0,1.0,0.0,0.0,0.0,0.0,0.0
69,Big businesses are the main beneficiaries of the government's coronavirus relief package,0.0,0.0,0.0,0.0,0.0,1.0,1.0
70,The vaccine for coronavirus is the only way to get out of this crisis,0.0,0.0,0.0,1.0,0.0,0.0,0.0
71,The president of the United States has been criticized for his handling of the coronavirus crisis,0.0,1.0,0.0,0.0,0.0,0.0,0.0
72,The recent protests have been fueled by economic inequality and racial injustice,0.0,0.0,0.0,0.0,1.0,0.0,0.0
73,Women should be given the same opportunities as men in the workplace,0.0,0.0,0.0,0.0,1.0,0.0,0.0
74,The media has been accused of giving too much attention to celebrities,0.0,0.0,0.0,0.0,0.0,1.0,0.0
75,The government should provide more financial support to small businesses,0.0,0.0,0.0,0.0,0.0,0.0,0.0
76,The current administration has been accused of favoring big businesses over small businesses,0.0,1.0,0.0,0.0,0.0,1.0,1.0
77,The wealthy should not be given tax breaks while the middle class is struggling,0.0,0.0,0.0,0.0,0.0,1.0,0.0
78,The government should invest more in public education to ensure equal access to quality education,0.0,0.0,0.0,0.0,1.0,0.0,0.0
79,Big businesses are taking advantage of the coronavirus crisis to increase their profits,0.0,0.0,0.0,0.0,0.0,1.0,1.0
80,The government should provide more support to those who have been affected by the coronavirus pandemic,0.0,0.0,0.0,0.0,0.0,0.0,0.0
81,The latest poll suggests the public is in favor of the new policies,0.0,0.0,0.0,0.0,0.0,0.0,0.0
82,The new policies are set to have a positive impact on the economy,0.0,0.0,0.0,0.0,0.0,0.0,0.0
83,The new policies will make a significant difference to the public,0.0,0.0,0.0,0.0,0.0,0.0,0.0
84,The government is trying to push their agenda through without any opposition,0.0,1.0,0.0,0.0,0.0,0.0,0.0
85,The new policies will only benefit the wealthy few,1.0,1.0,0.0,0.0,0.0,0.0,0.0
86,The new policies are the only way to restore order in the country,0.0,0.0,1.0,0.0,0.0,0.0,0.0
87,The public will be better off if the new policies are implemented,0.0,0.0,0.0,0.0,0.0,0.0,0.0
88,The government is trying to make the public believe that their policies are the only way out,0.0,1.0,1.0,1.0,0.0,0.0,0.0
89,The new policies will only benefit the rich and powerful,1.0,1.0,0.0,0.0,0.0,0.0,0.0
90,The new policies are the only way to save the country,0.0,0.0,1.0,1.0,0.0,0.0,0.0
91,The new policies will help the minority communities,0.0,0.0,0.0,0.0,1.0,0.0,0.0
92,The government is trying to make the public believe that their policies are the only solution,0.0,1.0,1.0,1.0,0.0,0.0,0.0
93,The new policies will provide more opportunities to the disadvantaged,0.0,0.0,0.0,0.0,1.0,0.0,0.0
94,The government is pushing their agenda through propaganda,0.0,1.0,0.0,0.0,0.0,0.0,0.0
95,The new policies will provide more benefits to the corporate sector,0.0,0.0,0.0,0.0,0.0,1.0,1.0
96,The government is trying to convince the public that their plans are the only way forward,0.0,1.0,1.0,1.0,0.0,0.0,0.0
97,The new policies will help the privileged classes,1.0,1.0,0.0,0.0,0.0,0.0,0.0
98,The government is using their influence to push their agenda through,0.0,1.0,0.0,0.0,0.0,0.0,0.0
99,The new policies will give an unfair advantage to the corporate sector,1.0,0.0,0.0,0.0,0.0,1.0,1.0
100,The government is trying to convince the public that their policies are the only way to move forward,0.0,1.0,1.0,1.0,0.0,0.0,0.0
101,The global economy has been improving since the great recession of 2008,0.0,0.0,0.0,0.0,0.0,0.0,0.0
102,The current president has done much to help the economy recover from the recession,0.0,0.0,0.0,0.0,0.0,0.0,0.0
103,Funding for public education has been drastically reduced in the last few years,0.0,0.0,0.0,0.0,0.0,1.0,0.0
104,The new medical insurance policy of the current government is helping the citizens in great ways,0.0,0.0,0.0,0.0,0.0,0.0,0.0
105,The current president has been heavily criticized for his foreign policy decisions,0.0,0.0,0.0,0.0,0.0,0.0,0.0
106,Reports have indicated that the current president's foreign policy decisions have been beneficial to some corporations,0.0,0.0,0.0,0.0,0.0,0.0,1.0
107,The current president has successfully cut taxes for the middle class,0.0,0.0,0.0,0.0,0.0,0.0,0.0
108,The current president has been accused of giving too much attention to the wealthy and not enough to the middle class,0.0,0.0,0.0,0.0,0.0,1.0,0.0
109,The current president has been accused of not being transparent in his dealings with foreign countries,0.0,0.0,0.0,0.0,0.0,1.0,0.0
110,The current president has been praised for his efforts to reduce unemployment,0.0,0.0,0.0,0.0,0.0,0.0,0.0
111,The current president has been accused of using his power to benefit his own agenda,0.0,1.0,0.0,0.0,0.0,1.0,0.0
112,The current president has been accused of giving preferential treatment to certain corporations,0.0,0.0,0.0,0.0,0.0,0.0,1.0
113,The current president has been accused of manipulating the media to his own ends,0.0,1.0,1.0,1.0,0.0,1.0,0.0
114,The current president has been accused of using his power to silence dissenting voices,0.0,1.0,0.0,0.0,0.0,1.0,0.0
115,The current president has been accused of using his power to discriminate against certain demographic groups,0.0,1.0,0.0,0.0,1.0,1.0,0.0
116,The current president has been praised for his efforts to reduce poverty,0.0,0.0,0.0,0.0,0.0,0.0,0.0
117,The current president has been accused of using his power to benefit his allies,0.0,1.0,0.0,0.0,0.0,1.0,0.0
118,The current president has been accused of using his power to benefit his family,0.0,1.0,0.0,0.0,0.0,1.0,0.0
119,The current president has been accused of using his power to influence the outcome of elections,0.0,1.0,1.0,1.0,0.0,1.0,0.0
120,The current president has been accused of using his power to suppress the media,0.0,1.0,1.0,1.0,0.0,1.0,0.0
121,The current president has been accused of using his power to benefit his supporters,0.0,1.0,0.0,0.0,0.0,1.0,0.0
122,The current president has been accused of using his power to favor certain corporate interests,0.0,1.0,0.0,0.0,0.0,1.0,1.0
123,The current president has been praised for his work to reduce crime and violence,0.0,0.0,0.0,0.0,0.0,0.0,0.0
124,The current president has been accused of using his power to push his own agenda,0.0,1.0,0.0,0.0,0.0,1.0,0.0
125,The current president has been accused of using his power to silence political opponents,0.0,1.0,0.0,0.0,0.0,1.0,0.0
126,The current president has been accused of using his power to manipulate public opinion,0.0,1.0,1.0,1.0,0.0,1.0,0.0
127,The current president has been accused of using his power to benefit his donors,0.0,1.0,0.0,0.0,0.0,1.0,0.0
128,The current president has been praised for his efforts to improve the environment,0.0,0.0,0.0,0.0,0.0,0.0,0.0
129,The current president has been accused of using his power to prioritize certain industries,0.0,1.0,0.0,0.0,0.0,1.0,1.0
130,The current president has been accused of using his power to limit freedom of speech,0.0,1.0,0.0,0.0,0.0,1.0,0.0
131,The current president has been accused of using his power to benefit the wealthy,0.0,1.0,0.0,0.0,0.0,1.0,0.0
132,The economy is growing rapidly,0.0,0.0,0.0,0.0,0.0,0.0,0.0
133,The president has been making great strides in the economy,0.0,0.0,0.0,0.0,0.0,0.0,0.0
134,The recent tax cuts have been beneficial for the middle class,0.0,0.0,0.0,0.0,0.0,0.0,0.0
135,The president's policies have been beneficial for the wealthy,0.0,1.0,0.0,0.0,0.0,0.0,0.0
136,The president's policies have been detrimental to the poor,0.0,1.0,0.0,0.0,0.0,0.0,0.0
137,The media has been biased in its coverage of the president,0.0,1.0,1.0,0.0,0.0,0.0,0.0
138,Certain outlets have disproportionately reported on the president's successes,0.0,1.0,1.0,0.0,0.0,1.0,0.0
139,The president's policies have been beneficial for all classes,0.0,1.0,0.0,0.0,0.0,0.0,0.0
140,The president's policies have been successful in creating job growth,0.0,1.0,0.0,0.0,0.0,0.0,0.0
141,The economic growth has been mainly attributed to the president's policies,0.0,1.0,1.0,0.0,0.0,0.0,0.0
142,The president has been using his bully pulpit to promote his policies,0.0,1.0,0.0,1.0,0.0,0.0,0.0
143,The president's policies have been disproportionately beneficial to the wealthy,0.0,1.0,0.0,0.0,0.0,1.0,0.0
144,The president has been using his influence to push corporate interests,0.0,1.0,0.0,0.0,0.0,0.0,1.0
145,The recent tax cuts have been disproportionately beneficial to the wealthy,0.0,1.0,0.0,0.0,0.0,1.0,0.0
146,The president's policies have been misrepresented by certain outlets,0.0,1.0,1.0,1.0,0.0,0.0,0.0
147,The president's policies have been targeted towards a specific demographic,0.0,1.0,0.0,0.0,1.0,0.0,0.0
148,The media has disproportionately reported on the president's successes,0.0,1.0,1.0,0.0,0.0,1.0,0.0
149,The economy has been growing steadily since the president took office,0.0,1.0,0.0,0.0,0.0,0.0,0.0
150,The president's policies have been beneficial for the middle class,0.0,1.0,0.0,0.0,0.0,0.0,0.0
151,Recent news reports have focused on the president's successes,0.0,1.0,1.0,0.0,0.0,1.0,0.0
152,The economy has been booming since the president took office,0.0,1.0,0.0,0.0,0.0,0.0,0.0
153,The president has been using his bully pulpit to push corporate interests,0.0,1.0,0.0,1.0,0.0,0.0,1.0
154,The recent tax cuts have been beneficial for the middle class,0.0,1.0,0.0,0.0,0.0,0.0,0.0
155,The president has been using his influence to promote his policies,0.0,1.0,0.0,1.0,0.0,0.0,0.0
156,The President spoke to a crowded room of supporters,0.0,0.0,0.0,0.0,0.0,0.0,0.0
157,The President's speech was heavily biased towards his own policies,1.0,0.0,0.0,0.0,0.0,0.0,0.0
158,The opposition was not given equal time to respond to the President's speech,0.0,0.0,1.0,0.0,0.0,0.0,0.0
159,"The President spoke using someone else's words, as if they were his own",0.0,0.0,0.0,1.0,0.0,0.0,0.0
160,"The President's speech was composed of largely white, male voices",0.0,0.0,0.0,0.0,1.0,0.0,0.0
161,The President's speech gave an undue amount of attention to his own party's point of view,0.0,0.0,0.0,0.0,0.0,1.0,0.0
162,The President's speech was mainly composed of corporate sponsors' views,0.0,0.0,0.0,0.0,0.0,0.0,1.0
163,"The President's speech was well-balanced and objective, addressing all sides of the issue",0.0,0.0,0.0,0.0,0.0,0.0,0.0
164,The President's speech was full of lies and misrepresentations of the facts,1.0,0.0,0.0,0.0,0.0,0.0,0.0
165,"The President's speech was partisan, favoring his own party's views over any others",0.0,1.0,0.0,0.0,0.0,0.0,0.0
166,The President's speech was composed of talking points from a major corporation,0.0,0.0,0.0,0.0,0.0,0.0,1.0
