,Sentence,Content Bias,Partisan Bias,False balance,Ventriloquism,Demographic bias,Undue Weight,Corporate
525,"Debates surrounding the adoption of renewable energy sources have highlighted their potential benefits for reducing greenhouse gas emissions and promoting energy independence, as well as concerns about their intermittency, land use impacts, and the need for grid modernization.",1.0,0.0,1.0,0.0,0.0,0.0,1.0
526,"The rise of telecommuting and remote work has prompted discussions about their potential benefits for work-life balance, productivity, and reduced transportation emissions, as well as concerns about the potential for social isolation, decreased collaboration, and digital divide issues.",0.0,0.0,0.0,0.0,0.0,1.0,0.0
527,"Controversial changes to immigration policy have sparked debates about the balance between ensuring national security, promoting economic growth, and protecting human rights, with some arguing that the new measures are necessary to safeguard borders, while others claim that they could lead to discrimination and social division.",1.0,0.0,1.0,0.0,0.0,0.0,0.0
528,"Efforts to address the gender pay gap have included calls for greater pay transparency, the implementation of equal pay legislation, and the promotion of workplace policies to address biases and barriers to career advancement.",0.0,0.0,0.0,0.0,1.0,0.0,0.0
529,"Debates about the role of nuclear energy in the transition to a low-carbon future have been fueled by concerns about safety, waste disposal, and the potential for nuclear proliferation, as well as the potential benefits of a reliable and low-emission energy source.",1.0,0.0,1.0,0.0,0.0,0.0,0.0
530,"The growing emphasis on STEM education has prompted discussions about the potential benefits for innovation and economic growth, as well as concerns about the potential neglect of other important subjects, such as the humanities and social sciences.",0.0,0.0,1.0,0.0,0.0,1.0,0.0
531,"Discussions about the potential benefits and risks of cryptocurrencies have led to calls for greater regulation, consumer protections, and the development of new technologies to address issues related to security, volatility, and environmental impacts.",0.0,0.0,0.0,0.0,0.0,1.0,1.0
532,"Debates surrounding the use of facial recognition technology have highlighted its potential benefits for security and law enforcement, as well as concerns about privacy, surveillance, and the potential for bias and misuse.",1.0,0.0,1.0,0.0,0.0,0.0,0.0
533,"Efforts to address the opioid crisis have included calls for increased access to treatment, the implementation of prescription drug monitoring programs, and policies to address the root causes of addiction and overdose.",0.0,0.0,0.0,0.0,0.0,1.0,0.0
534,"Controversial changes to net neutrality regulations have sparked debates about the balance between promoting innovation and investment, and ensuring equal access to information and online services, with some arguing that the new measures are necessary to foster competition, while others claim that they could lead to a tiered internet and reduced consumer choice.",1.0,0.0,1.0,0.0,0.0,0.0,1.0
535,"The increasing importance of cybersecurity has led to calls for greater investment in research, training, and infrastructure, as well as concerns about the potential for state-sponsored cyberattacks, the erosion of privacy, and the need for international cooperation.",0.0,0.0,0.0,0.0,0.0,1.0,1.0
536,"Debate over the role of social media platforms in the spread of misinformation has led to discussions about their potential benefits for connecting people and promoting free speech, as well as concerns about the potential for echo chambers, filter bubbles, and the erosion of trust in journalism.",1.0,0.0,1.0,0.0,0.0,0.0,1.0
537,"Efforts to address the global refugee crisis have included calls for increased humanitarian aid, the development of policies to address the root causes of forced migration, and the promotion of international cooperation and burden-sharing.",0.0,0.0,0.0,0.0,0.0,1.0,0.0
538,"Debates about the role of single-use plastics in environmental pollution have led to calls for greater recycling efforts, the development of biodegradable alternatives, and the implementation of policies to reduce plastic waste, as well as concerns about the potential impacts on consumer convenience and industry competitiveness.",1.0,0.0,1.0,0.0,0.0,0.0,0.0
539,"The ongoing debate about the role of pesticides in agriculture has been fueled by concerns about their impacts on human health, biodiversity, and water quality, as well as the potential benefits of improved crop yields and resistance to pests and diseases.",1.0,0.0,1.0,0.0,0.0,0.0,1.0
540,"Discussions about the importance of financial literacy education have highlighted the need for greater access to resources, programs, and policies to ensure that individuals are equipped to navigate the increasingly complex world of personal finance.",0.0,0.0,0.0,0.0,0.0,1.0,0.0
541,"Debate over the role of minimum wage policies in addressing income inequality has led to discussions about their potential benefits for low-income workers, as well as concerns about the potential impacts on small businesses, job creation, and the cost of living.",1.0,0.0,1.0,0.0,0.0,0.0,0.0
542,"The growing interest in urban farming has prompted discussions about its potential benefits for food security, environmental sustainability, and community engagement, as well as concerns about the potential impacts on land use, zoning, and infrastructure needs.",0.0,0.0,1.0,0.0,0.0,1.0,0.0
543,"Efforts to address the issue of food waste have included calls for improved supply chain efficiency, consumer education, and the promotion of policies and technologies to reduce waste and increase resource recovery.",0.0,0.0,0.0,0.0,0.0,1.0,0.0
544,"The adoption of electric vehicles has prompted discussions about their potential benefits for reducing greenhouse gas emissions and promoting energy independence, as well as concerns about their range, charging infrastructure, and the environmental impacts of battery production.",0.0,0.0,1.0,0.0,0.0,1.0,1.0
545,"Controversial changes to gun control regulations have sparked debates about the balance between protecting individual rights and ensuring public safety, with some arguing that the new measures are necessary to prevent gun violence, while others claim that they infringe on constitutional rights and could lead to increased crime.",1.0,0.0,1.0,0.0,0.0,0.0,0.0
546,"Efforts to promote mental health awareness have included calls for increased access to mental health services, the reduction of stigma, and the implementation of policies to support mental wellbeing in the workplace and educational settings.",0.0,0.0,0.0,0.0,0.0,1.0,0.0
547,"Debates surrounding the use of genetically modified organisms (GMOs) in agriculture have highlighted their potential benefits for increasing crop yields, reducing pesticide use, and addressing global food security, as well as concerns about their potential impacts on human health, biodiversity, and the environment.",1.0,0.0,1.0,0.0,0.0,0.0,1.0
548,"The ongoing debate about the role of private prisons in the criminal justice system has been fueled by concerns about their influence on policy, inmate conditions, and the potential for conflicts of interest, as well as the potential benefits of cost savings and innovation.",1.0,0.0,1.0,0.0,0.0,0.0,1.0
549,"Efforts to address the affordable housing crisis have included calls for increased investment in public housing, rent control policies, and the promotion of policies to address the root causes of housing insecurity, such as income inequality and gentrification.",0.0,0.0,0.0,0.0,0.0,1.0,0.0
550,"Debates about the role of autonomous weapons systems in modern warfare have led to calls for a ban on their development and use, as well as concerns about the potential impacts on military decision-making, accountability, and the risk of unintended escalation.",1.0,0.0,1.0,0.0,0.0,0.0,0.0
551,"The increasing prevalence of remote work has prompted discussions about its potential benefits for work-life balance, productivity, and reduced transportation emissions, as well as concerns about the potential for social isolation, decreased collaboration, and digital divide issues.",0.0,0.0,0.0,0.0,0.0,1.0,0.0
552,"Controversial changes to campaign finance regulations have sparked debates about the balance between protecting free speech and ensuring a level playing field in elections, with some arguing that the new measures are necessary to prevent corruption, while others claim that they could lead to increased influence by special interests.",1.0,0.0,1.0,0.0,0.0,0.0,0.0
553,"Debates surrounding the use of drones for commercial and recreational purposes have highlighted their potential benefits for innovation and economic growth, as well as concerns about privacy, safety, and the need for regulation.",0.0,0.0,0.0,0.0,0.0,1.0,1.0
554,"Climate change's impacts on agriculture have sparked discussions about the need for more sustainable farming practices, crop diversification, and the adoption of new technologies.",0.0,0.0,0.0,0.0,0.0,1.0,0.0
555,"Concerns about the impact of automation on employment have led to calls for policies to support worker retraining and education, as well as discussions about the potential benefits of increased productivity and innovation.",0.0,0.0,0.0,0.0,0.0,1.0,1.0
556,"The growing popularity of plant-based diets has prompted debates about their potential health, environmental, and ethical benefits, as well as concerns about nutritional adequacy and potential impacts on the agricultural industry.",1.0,0.0,1.0,0.0,0.0,0.0,0.0
557,"Efforts to improve access to healthcare services have included calls for the expansion of telemedicine, the promotion of community-based health initiatives, and the development of policies to address disparities in access and outcomes.",0.0,0.0,0.0,0.0,0.0,1.0,0.0
558,"Debates about the impact of social media on mental health have led to discussions about the potential benefits of fostering social connections, as well as concerns about addiction, cyberbullying, and the erosion of self-esteem.",1.0,0.0,1.0,0.0,0.0,0.0,1.0
559,"Discussions surrounding the role of public transportation in promoting sustainable urban development have highlighted its potential benefits for reducing congestion, emissions, and improving quality of life, while also addressing concerns about funding, accessibility, and infrastructure needs.",0.0,0.0,1.0,0.0,0.0,1.0,0.0
560,"Efforts to combat plastic pollution have included calls for increased recycling efforts, bans on single-use plastics, and the development of biodegradable alternatives.",0.0,0.0,0.0,0.0,0.0,1.0,0.0
561,"Controversial changes to voting regulations have sparked debates about the balance between ensuring electoral integrity and protecting the right to vote, with some arguing that the new measures are necessary to prevent fraud, while others claim that they could lead to voter suppression and disenfranchisement.",1.0,0.0,1.0,0.0,0.0,0.0,0.0
562,"The increasing use of renewable energy has prompted discussions about its potential benefits for reducing greenhouse gas emissions, promoting energy independence, and fostering innovation, as well as concerns about intermittency, land use, and the need for grid modernization.",0.0,0.0,1.0,0.0,0.0,1.0,1.0
563,"Efforts to promote financial inclusion have included calls for greater access to banking services, affordable credit, and financial education programs.",0.0,0.0,0.0,0.0,0.0,1.0,0.0
564,"The growing emphasis on mental health in the workplace has led to calls for the implementation of policies to support employee wellbeing, such as flexible work arrangements, access to counseling services, and stress reduction initiatives.",0.0,0.0,0.0,0.0,0.0,1.0,0.0
565,The President addressed the nation about the importance of climate change and the need for immediate action,0.0,0.0,0.0,0.0,0.0,0.0,1.0
566,"The left-wing media praised the President's speech, while the right-wing media criticized it",1.0,1.0,0.0,0.0,0.0,0.0,0.0
567,"The science behind climate change is undeniable, but some politicians continue to deny its existence",0.0,0.0,0.0,0.0,0.0,1.0,0.0
568,The CEO of the company announced a new product launch and emphasized its innovative features,0.0,0.0,0.0,0.0,0.0,0.0,1.0
569,A controversial article published in a tabloid newspaper spread false information about a celebrity's personal life,1.0,0.0,1.0,0.0,0.0,0.0,1.0
570,The editorial board of the newspaper endorsed the Democratic candidate for mayor in the upcoming election,0.0,1.0,0.0,0.0,0.0,0.0,0.0
571,The Supreme Court issued a ruling that could have a major impact on abortion rights in the country,0.0,0.0,0.0,0.0,0.0,1.0,0.0
572,A study found that women are underrepresented in leadership positions in many industries,0.0,0.0,0.0,0.0,1.0,1.0,0.0
573,An investigative report revealed that a major corporation had been hiding information about its products' safety risks,0.0,0.0,0.0,0.0,0.0,1.0,1.0
574,A political commentator on a news show argued that the media was biased against a particular political party,0.0,1.0,0.0,0.0,0.0,0.0,0.0
575,The author of the bestselling novel gave an interview about the book's themes and characters,0.0,0.0,0.0,0.0,0.0,0.0,1.0
576,An opinion piece in the newspaper argued that the government's policies were harming the middle class,0.0,1.0,0.0,0.0,0.0,0.0,0.0
577,A news anchor reported on a new study that showed a rise in hate crimes against minority groups,0.0,0.0,0.0,0.0,1.0,0.0,0.0
578,A technology journalist wrote an article about the pros and cons of using social media for activism,0.0,0.0,0.0,0.0,0.0,0.0,1.0
579,A political campaign ad attacked the opponent's record on healthcare and claimed their policies would harm seniors,1.0,1.0,0.0,0.0,0.0,0.0,0.0
580,A news outlet faced criticism for giving a platform to a known conspiracy theorist,0.0,0.0,0.0,1.0,0.0,0.0,1.0
581,A celebrity made a controversial statement on social media and faced backlash from fans and critics,0.0,0.0,0.0,0.0,0.0,0.0,1.0
582,A columnist in the newspaper wrote an article about the importance of mental health and access to care,0.0,0.0,0.0,0.0,0.0,0.0,0.0
583,"A viral video showed a police officer using excessive force during an arrest, sparking outrage and protests",0.0,0.0,0.0,0.0,1.0,0.0,0.0
584,The new law that was passed in the state aims to protect workers' rights and improve working conditions,0.0,0.0,0.0,0.0,0.0,0.0,1.0
585,"A conservative news outlet criticized the President's policies on immigration, while a liberal news outlet defended them",1.0,1.0,0.0,0.0,0.0,0.0,0.0
586,"Despite overwhelming evidence to the contrary, some individuals still believe that vaccines are dangerous",0.0,0.0,0.0,0.0,0.0,1.0,0.0
587,The CEO of the company faced backlash for making insensitive comments about a marginalized group of employees,0.0,0.0,0.0,0.0,1.0,0.0,1.0
588,A sensational headline in a gossip magazine spread rumors about a celebrity's alleged affair with a co-star,1.0,0.0,1.0,0.0,0.0,0.0,1.0
589,The President's press secretary dodged questions from reporters about a controversial decision made by the administration,0.0,0.0,0.0,1.0,0.0,0.0,1.0
590,A recent study found that many Americans are struggling to make ends meet due to rising living costs,0.0,0.0,0.0,0.0,1.0,1.0,0.0
591,A popular science magazine published an article about groundbreaking research into the human brain and its functions,0.0,0.0,0.0,0.0,0.0,0.0,1.0
592,"An investigative journalist exposed corruption and bribery within a major corporation, leading to a criminal investigation",0.0,0.0,0.0,0.0,0.0,1.0,1.0
593,A political commentator on a news show accused the opposing party of voter suppression and rigging elections,0.0,1.0,0.0,0.0,0.0,0.0,0.0
594,"An author of a controversial book was invited to speak at a university, sparking protests and debates over free speech",0.0,0.0,0.0,0.0,0.0,0.0,1.0
595,A series of articles in a newspaper shed light on the plight of refugees and their struggles to find safety and security,0.0,0.0,0.0,0.0,1.0,0.0,0.0
596,"A tech blogger wrote about the latest gadgets and innovations in the field, offering insights and recommendations",0.0,0.0,0.0,0.0,0.0,0.0,1.0
597,A political campaign ad accused the opponent of being soft on crime and endangering the safety of citizens,1.0,1.0,0.0,0.0,0.0,0.0,0.0
598,A news outlet faced backlash for publishing an opinion piece that was deemed offensive and insensitive to a certain group of people,0.0,0.0,0.0,1.0,0.0,0.0,1.0
599,A social media influencer faced criticism for promoting a controversial product that was deemed harmful by experts,0.0,0.0,0.0,0.0,0.0,0.0,1.0
600,A renowned scientist wrote an op-ed in a newspaper about the need for increased funding and support for scientific research,0.0,0.0,0.0,0.0,0.0,0.0,0.0
601,"An amateur video showed a group of activists protesting against police brutality, highlighting the need for systemic change",0.0,0.0,0.0,0.0,1.0,0.0,0.0
602,"The United Nations recently released a report warning of a global climate catastrophe and urging immediate action to mitigate the effects of climate change, but some politicians continue to deny the scientific consensus on the issue.",1.0,0.0,0.0,0.0,0.0,1.0,0.0
603,"An investigative journalist uncovered a web of corruption and cronyism within the highest levels of government, leading to the resignation of several officials and a national scandal.",0.0,0.0,0.0,0.0,0.0,1.0,1.0
604,"A popular news anchor reported on the recent outbreak of a deadly virus, causing panic and concern among the public and leading to a surge in demand for medical supplies.",0.0,0.0,0.0,0.0,0.0,0.0,1.0
605,"A prominent economist argued in a recent book that income inequality is one of the greatest threats facing modern society, but some critics claim that his proposals for reform would be impractical and unrealistic.",0.0,0.0,0.0,0.0,0.0,1.0,0.0
606,The President's recent decision to impose tariffs on imported goods has sparked a fierce debate over the future of international trade and the impact of protectionist policies on the global economy.,0.0,1.0,0.0,0.0,0.0,0.0,0.0
607,A recent study conducted by a group of scientists found that the use of pesticides in agriculture is having a devastating effect on the environment and contributing to the decline of many species of wildlife.,1.0,0.0,0.0,0.0,0.0,1.0,0.0
608,"The media coverage of a recent political scandal has been heavily biased, with some news outlets focusing on sensational details and others downplaying the severity of the allegations.",1.0,0.0,0.0,0.0,0.0,0.0,0.0
609,"A celebrity's controversial tweet sparked a heated debate on social media, with many users criticizing the star's comments and others defending their right to free speech.",0.0,0.0,0.0,0.0,0.0,0.0,1.0
610,"The recent wave of protests against police brutality and racial injustice has highlighted the urgent need for reform in law enforcement and the criminal justice system, but some critics argue that the movement has been hijacked by extremist groups.",0.0,0.0,0.0,0.0,1.0,0.0,0.0
611,"A series of articles in a major newspaper exposed the dark side of the beauty industry, revealing the use of harmful chemicals and unethical practices to produce cosmetic products.",1.0,0.0,0.0,0.0,0.0,1.0,1.0
612,An op-ed in a conservative magazine argued that the government's recent decision to expand social welfare programs is misguided and will only lead to greater dependency and inefficiency.,1.0,1.0,0.0,0.0,0.0,0.0,0.0
613,"A recent report by a human rights organization shed light on the plight of refugees and asylum seekers in a certain region, exposing the mistreatment and abuse they often face at the hands of government authorities.",0.0,0.0,0.0,0.0,1.0,0.0,0.0
614,"A tech startup's new app promises to revolutionize the way we communicate and collaborate online, but some experts are skeptical of its claims and warn of potential privacy concerns.",0.0,0.0,0.0,0.0,0.0,0.0,1.0
615,"An investigative report by a news outlet uncovered widespread corruption and abuse of power within a major corporation, leading to calls for regulatory reform and greater accountability.",0.0,0.0,0.0,0.0,0.0,1.0,1.0
616,"A series of tweets by a controversial figure sparked outrage and condemnation, with many users calling for the social media platform to ban the individual from their service.",0.0,0.0,0.0,0.0,0.0,0.0,1.0
617,"The recent surge in violence against Asian Americans has highlighted the ongoing issue of racism and discrimination in the United States, with many activists calling for greater awareness and action to address the problem.",0.0,0.0,0.0,0.0,1.0,0.0,0.0
618,"A conservative commentator on a news show accused the mainstream media of bias and called for greater scrutiny of their reporting, while a liberal commentator defended the press and their role in holding the powerful accountable.",0.0,1.0,0.0,0.0,0.0,0.0,0.0
619,"A recent study found that the majority of Americans support stricter gun control measures, but some lawmakers and interest groups continue to resist any attempts at reform.",0.0,0.0,0.0,0.0,0.0,1.0,0.0
620,"The recent wave of protests and unrest in a certain country has sparked a global conversation about human rights and the need for democratic reform, but some governments have been criticized for their silence and lack of action.",0.0,0.0,0.0,0.0,1.0,0.0,0.0
621,"A popular celebrity made controversial comments about a sensitive political issue, drawing condemnation from both supporters and critics.",0.0,0.0,0.0,0.0,0.0,0.0,1.0
622,A recent article in a medical journal warned of the dangers of antibiotic resistance and called for greater efforts to develop new treatments and prevent the spread of drug-resistant infections.,0.0,0.0,0.0,0.0,0.0,0.0,1.0
623,"A political campaign ad accused the opposing candidate of being a tool of wealthy donors and special interests, while the candidate's supporters argued that their policies would benefit all Americans.",1.0,1.0,0.0,0.0,0.0,0.0,0.0
624,"The recent surge in popularity of a certain social media platform has raised concerns about privacy and data security, with some experts calling for greater regulation and oversight of the industry.",0.0,0.0,0.0,0.0,0.0,0.0,1.0
625,A recent scandal involving a high-profile business executive has shaken the public's confidence in the company and led to calls for greater transparency and accountability in corporate governance.,0.0,0.0,0.0,0.0,0.0,1.0,1.0
626,The recent controversy surrounding a bestselling novel has sparked a debate about the boundaries of artistic expression and the responsibility of authors to be sensitive to cultural and historical context.,0.0,0.0,0.0,0.0,0.0,0.0,1.0
627,"A political commentator on a cable news show accused the opposing party of hypocrisy and corruption, while a commentator from the opposing party argued that the accusations were baseless and politically motivated.",0.0,1.0,0.0,0.0,0.0,0.0,0.0
628,"A recent survey found that a majority of voters support policies aimed at reducing economic inequality, but some politicians argue that such policies would harm the economy and stifle innovation.",0.0,0.0,0.0,0.0,0.0,1.0,0.0
629,"The recent surge in hate crimes against members of the LGBTQ+ community has highlighted the need for greater protections and awareness of the issue, but some critics argue that such crimes are isolated incidents and not indicative of a larger problem.",0.0,0.0,0.0,0.0,1.0,0.0,0.0
630,A news article about a recent protest against police brutality and racial injustice sparked controversy when it was revealed that the author had plagiarized portions of the piece.,0.0,0.0,0.0,0.0,1.0,0.0,1.0
631,The recent wildfires in a certain region have raised concerns about the impact of climate change and the need for greater action to reduce greenhouse gas emissions and mitigate the effects of global warming.,0.0,0.0,0.0,0.0,0.0,1.0,0.0
632,"A recent study found that the majority of Americans support the legalization of marijuana, but some politicians and interest groups continue to resist any attempts at reform.",0.0,0.0,0.0,0.0,0.0,1.0,0.0
633,"A controversial policy implemented by a certain government has sparked protests and international condemnation, with critics arguing that the policy violates basic human rights and is counterproductive to the government's stated goals.",0.0,0.0,0.0,0.0,1.0,0.0,0.0
634,"A recent opinion piece in a major newspaper argued that the increasing polarization and divisiveness in American politics is threatening the country's democracy and stability, while others argue that such divisions are a natural part of the political process.",0.0,0.0,0.0,0.0,0.0,0.0,1.0
635,"The recent surge in popularity of a certain diet trend has raised concerns among health experts about the safety and efficacy of such diets, with some warning of potential long-term health risks.",0.0,0.0,0.0,0.0,0.0,0.0,1.0
636,"A political campaign ad accused the opposing candidate of being out of touch with the concerns of everyday Americans and beholden to corporate interests, while the candidate's supporters argued that their policies would benefit all Americans.",1.0,1.0,0.0,0.0,0.0,0.0,0.0
637,"The recent surge in gun violence in a certain city has sparked a debate about the role of guns in American society and the need for stricter gun control laws, but some advocates argue that such laws would be ineffective and infringe on the Second Amendment rights of law-abiding citizens.",0.0,0.0,0.0,0.0,0.0,1.0,0.0
638,"A recent scandal involving a high-profile public figure has drawn attention to the issue of sexual harassment and abuse in the workplace, leading to calls for greater accountability and reform in corporate culture.",0.0,0.0,0.0,0.0,1.0,0.0,1.0
