,Sentence,Content Bias,Partisan Bias,False balance,Ventriloquism,Demographic bias,Undue Weight,Corporate
1365,"Debates about the role of government intervention in healthcare have led to discussions about the potential benefits of a single-payer system, such as reduced administrative costs and improved access to care, as well as concerns about the potential for increased taxes, decreased innovation, and longer wait times.",1.0,0.0,1.0,0.0,0.0,0.0,0.0
1366,"The growing interest in renewable energy has prompted discussions about its potential benefits for reducing greenhouse gas emissions, promoting energy independence, and fostering innovation, as well as concerns about the intermittency of renewable energy sources, the environmental impacts of their production, and the affordability of clean energy.",0.0,0.0,1.0,0.0,0.0,1.0,1.0
1367,"Controversial changes to voter identification laws have sparked debates about the balance between protecting the integrity of elections and ensuring the right to vote, with some arguing that the new measures are necessary to prevent voter fraud, while others claim that they disproportionately impact marginalized communities and suppress voter turnout.",1.0,0.0,1.0,0.0,0.0,0.0,0.0
1368,"Efforts to promote body positivity have included calls for greater diversity in media representation, the implementation of policies to combat weight discrimination, and the development of strategies to address unhealthy beauty standards.",0.0,0.0,0.0,0.0,0.0,1.0,0.0
1369,"Debates about the role of animal testing in scientific research have led to calls for the development of alternative testing methods, the implementation of policies to ensure the ethical treatment of laboratory animals, and discussions about the reliability and relevance of animal testing data.",1.0,0.0,1.0,0.0,0.0,0.0,1.0
1370,"Discussions surrounding the impact of tourism on local communities have highlighted the need for greater investment in sustainable tourism initiatives, the promotion of policies to support local economies and culture, and the development of strategies to address the negative consequences of overtourism, such as environmental degradation and cultural erosion.",0.0,0.0,0.0,0.0,0.0,1.0,0.0
1371,"Efforts to address the issue of food waste have included calls for greater investment in food recovery programs, the implementation of policies to promote more efficient production and distribution processes, and the development of technologies to reduce food spoilage.",0.0,0.0,0.0,0.0,0.0,1.0,1.0
1372,"Debates about the impact of gentrification on urban communities have led to calls for the implementation of policies to preserve affordable housing and support local businesses, as well as concerns about the potential for displacement, rising income inequality, and the loss of cultural heritage.",1.0,0.0,1.0,0.0,0.0,0.0,0.0
1373,The president announced a new policy today,1.0,1.0,0.0,0.0,0.0,1.0,0.0
1374,The Republican senator criticized the proposal as too expensive,1.0,1.0,0.0,0.0,0.0,0.0,0.0
1375,The Democratic congresswoman praised the plan as a step in the right direction,1.0,1.0,0.0,0.0,0.0,0.0,0.0
1376,Some experts argue that the policy will have unintended consequences,0.0,0.0,0.0,0.0,0.0,1.0,0.0
1377,Critics accuse the government of ignoring the needs of minority communities,0.0,0.0,0.0,0.0,1.0,1.0,0.0
1378,The CEO defended the company's decision to lay off workers,0.0,0.0,0.0,0.0,0.0,0.0,1.0
1379,"In a recent study, researchers found that exercise can improve mental health",0.0,0.0,0.0,0.0,0.0,0.0,0.0
1380,The mayor announced a plan to reduce crime in the city,0.0,0.0,0.0,0.0,0.0,0.0,0.0
1381,The article criticized the use of animal testing in the cosmetics industry,1.0,0.0,0.0,0.0,0.0,1.0,0.0
1382,The author argues that the government's response to climate change has been inadequate,1.0,1.0,0.0,0.0,0.0,1.0,0.0
1383,The journalist interviewed several people who were affected by the hurricane,0.0,0.0,0.0,0.0,0.0,0.0,0.0
1384,The study found that women are underrepresented in leadership positions,0.0,0.0,0.0,0.0,1.0,1.0,0.0
1385,Scientists warn that the use of pesticides is harming the environment,0.0,0.0,0.0,0.0,0.0,1.0,0.0
1386,The author argues that the media is biased against certain political groups,0.0,1.0,0.0,0.0,0.0,1.0,0.0
1387,The article presents both sides of the debate on gun control,0.0,0.0,1.0,0.0,0.0,0.0,0.0
1388,The CEO announced record profits for the quarter,0.0,0.0,0.0,0.0,0.0,0.0,1.0
1389,The study found no significant difference between the two treatments,0.0,0.0,0.0,0.0,0.0,0.0,0.0
1390,The politician's remarks were criticized for being insensitive to certain groups,0.0,0.0,0.0,0.0,1.0,1.0,0.0
1391,The article highlights the benefits of renewable energy sources,0.0,0.0,0.0,0.0,0.0,0.0,0.0
1392,The author argues that the education system is failing students,1.0,0.0,0.0,0.0,0.0,1.0,0.0
1393,The journalist interviewed the CEO about the company's recent scandal,0.0,0.0,0.0,0.0,0.0,0.0,1.0
1394,The study found that income inequality is a major issue in the country,0.0,0.0,0.0,0.0,1.0,1.0,0.0
1395,The article discusses the pros and cons of genetically modified food,0.0,0.0,0.0,0.0,0.0,0.0,0.0
1396,The politician's speech was criticized for being overly simplistic and misleading,1.0,1.0,0.0,0.0,0.0,1.0,0.0
1397,The author argues that the criminal justice system is biased against certain groups,1.0,0.0,0.0,0.0,1.0,1.0,0.0
1398,The journalist investigated allegations of corruption in the local government,0.0,0.0,0.0,0.0,0.0,0.0,0.0
1399,The study found that social media use is linked to increased feelings of loneliness,0.0,0.0,0.0,0.0,0.0,0.0,0.0
1400,The article examines the impact of climate change on wildlife habitats,0.0,0.0,0.0,0.0,0.0,0.0,0.0
1401,The CEO apologized for the company's poor customer service,0.0,0.0,0.0,0.0,0.0,0.0,1.0
1402,The author argues that the government's immigration policies are inhumane,1.0,1.0,0.0,0.0,1.0,1.0,0.0
1403,The journalist interviewed residents about the impact of a recent natural disaster,0.0,0.0,0.0,0.0,0.0,0.0,0.0
1404,The study found that sleep is important for overall health and well-being,0.0,0.0,0.0,0.0,0.0,0.0,0.0
1405,The article examines the causes and consequences of income inequality,0.0,0.0,0.0,0.0,1.0,1.0,0.0
1406,The politician's controversial comments sparked a heated debate,1.0,1.0,0.0,0.0,0.0,1.0,0.0
1407,The author argues that the media is complicit in perpetuating harmful stereotypes,1.0,0.0,0.0,0.0,1.0,1.0,0.0
1408,The journalist investigated claims of police brutality in the local community,0.0,0.0,0.0,0.0,0.0,0.0,0.0
1409,The study found that mindfulness meditation can reduce stress and anxiety,0.0,0.0,0.0,0.0,0.0,0.0,0.0
1410,The article explores the ethical implications of artificial intelligence,0.0,0.0,0.0,0.0,0.0,0.0,0.0
1411,The CEO announced plans to expand the company's operations overseas,0.0,0.0,0.0,0.0,0.0,0.0,1.0
1412,The author argues that the government's response to the opioid epidemic is inadequate,1.0,1.0,0.0,0.0,0.0,1.0,0.0
1413,The journalist interviewed experts about the impact of climate change on agriculture,0.0,0.0,0.0,0.0,0.0,0.0,0.0
1414,The study found that exercise can improve cognitive function in older adults,0.0,0.0,0.0,0.0,0.0,0.0,0.0
1415,The article examines the role of technology in shaping modern society,0.0,0.0,0.0,0.0,0.0,0.0,0.0
1416,The politician's proposal was criticized for being unrealistic and unfeasible,1.0,1.0,0.0,0.0,0.0,1.0,0.0
1417,The author argues that the media is biased in favor of certain political candidates,1.0,1.0,0.0,0.0,0.0,1.0,0.0
1418,The journalist investigated claims of workplace discrimination at a local business,0.0,0.0,0.0,0.0,1.0,0.0,0.0
1419,The study found that exposure to nature can improve mental health and well-being,0.0,0.0,0.0,0.0,0.0,0.0,0.0
1420,The article discusses the impact of social media on mental health and well-being,0.0,0.0,0.0,0.0,0.0,0.0,0.0
1421,The CEO announced plans to invest in renewable energy technologies,0.0,0.0,0.0,0.0,0.0,0.0,1.0
1422,The author argues that the government's tax policies favor the wealthy,1.0,1.0,0.0,0.0,1.0,1.0,0.0
1423,The journalist interviewed survivors of a recent natural disaster,0.0,0.0,0.0,0.0,0.0,0.0,0.0
1424,The study found that regular exercise can reduce the risk of developing chronic diseases,0.0,0.0,0.0,0.0,0.0,0.0,0.0
1425,The article explores the impact of globalization on cultural identity,0.0,0.0,0.0,0.0,0.0,0.0,0.0
1426,The politician's controversial remarks drew criticism from both sides of the aisle,1.0,1.0,0.0,0.0,0.0,1.0,0.0
1427,The author argues that the media's coverage of mass shootings is sensationalized and harmful,1.0,0.0,0.0,0.0,1.0,1.0,0.0
1428,The journalist investigated claims of police misconduct in the local community,0.0,0.0,0.0,0.0,0.0,0.0,0.0
1429,The study found that exposure to natural environments can improve cognitive function,0.0,0.0,0.0,0.0,0.0,0.0,0.0
1430,"Discussions surrounding the role of private prisons in the criminal justice system have highlighted concerns about the potential for profit-driven motives to compromise inmate well-being and rehabilitation, as well as arguments about the potential cost savings and increased efficiency of private management.",1.0,0.0,1.0,0.0,0.0,0.0,1.0
1431,"Efforts to address the digital divide have included calls for increased investment in broadband infrastructure, the promotion of policies to ensure affordable access to technology, and the development of digital literacy programs for underserved populations.",0.0,0.0,0.0,0.0,0.0,1.0,0.0
1432,"Debates about the impact of standardized testing on the education system have led to discussions about the potential benefits of data-driven accountability and objective performance measurement, as well as concerns about the potential for teaching to the test, test-induced stress, and a narrowed curriculum.",1.0,0.0,1.0,0.0,0.0,0.0,1.0
1433,"Discussions surrounding the potential benefits and risks of gene editing technologies, such as CRISPR, have highlighted their potential for revolutionizing medicine, agriculture, and conservation, as well as concerns about the ethical implications, potential for unintended consequences, and the possibility of exacerbating existing social inequalities.",0.0,0.0,1.0,0.0,0.0,0.0,0.0
1434,"Efforts to address the issue of air pollution have included calls for greater investment in clean energy technologies, the implementation of policies to regulate emissions, and the development of strategies to reduce traffic congestion and promote public transportation.",0.0,0.0,0.0,0.0,0.0,1.0,1.0
1435,"Debates about the role of technology in education have led to discussions about the potential benefits of personalized learning, increased access to information, and the development of critical thinking skills, as well as concerns about the potential for decreased social interaction, the digital divide, and the erosion of traditional teaching methods.",1.0,0.0,1.0,0.0,0.0,0.0,0.0
1436,"Discussions surrounding the impact of social media influencers on consumer behavior have highlighted the need for greater transparency in advertising, the development of policies to ensure ethical marketing practices, and the potential for influencers to promote positive social change.",0.0,0.0,0.0,0.0,0.0,1.0,1.0
1437,"Efforts to combat climate change have included calls for the implementation of carbon pricing mechanisms, such as cap-and-trade systems and carbon taxes, as well as debates about their potential effectiveness, economic impacts, and distributional consequences.",1.0,0.0,1.0,0.0,0.0,0.0,0.0
1438,"Debates about the impact of video games on mental health have led to discussions about the potential benefits of cognitive training, social connection, and stress relief, as well as concerns about the potential for addiction, violence, and the normalization of harmful behavior.",1.0,0.0,1.0,0.0,0.0,0.0,1.0
1439,"Discussions surrounding the future of work in the age of automation have highlighted the need for greater investment in skills training, the promotion of policies to support displaced workers, and the development of strategies to ensure that the benefits of technological advancements are equitably shared.",0.0,0.0,0.0,0.0,0.0,1.0,0.0
1440,"Efforts to address the issue of mental health stigma have included calls for greater public awareness, the implementation of policies to ensure equal treatment for mental health conditions, and the promotion of initiatives to encourage open dialogue about mental health.",0.0,0.0,0.0,0.0,0.0,1.0,1.0
1441,"Debates about the impact of free speech on college campuses have led to calls for the protection of open dialogue and the exchange of ideas, as well as concerns about the potential for hate speech, harassment, and the silencing of marginalized voices.",1.0,0.0,1.0,0.0,0.0,0.0,0.0
1442,"Discussions on the role of artificial intelligence in society have sparked debates on job displacement, biased algorithms, privacy concerns, and ethical considerations, while also highlighting the potential for increased efficiency, improved decision-making, and economic growth.",1.0,0.0,1.0,0.0,0.0,0.0,1.0
1443,"Efforts to promote gender equality have involved advocating for pay equity, workplace diversity, representation in leadership positions, and combating gender stereotypes.",0.0,0.0,0.0,0.0,0.0,1.0,0.0
1444,"Debates around the pros and cons of homeschooling often involve discussions about academic performance, socialization, parental involvement, and the flexibility to adapt to individual learning needs.",1.0,0.0,1.0,0.0,0.0,0.0,0.0
1445,"Discussions on the impact of urban sprawl include concerns about environmental degradation, loss of agricultural land, traffic congestion, and social isolation, while also acknowledging potential economic development opportunities.",0.0,0.0,1.0,0.0,0.0,0.0,0.0
1446,"Efforts to reduce income inequality involve policy discussions surrounding progressive taxation, social welfare programs, minimum wage increases, and investments in education and job training.",0.0,0.0,0.0,0.0,0.0,1.0,0.0
1447,"Debates on the role of pharmaceutical companies in the opioid crisis often focus on corporate responsibility, aggressive marketing practices, over-prescription by doctors, and the need for better regulation.",1.0,0.0,1.0,0.0,0.0,0.0,1.0
1448,"Discussions on the impact of international trade often involve examining job creation, economic growth, consumer choice, and innovation, while also considering potential downsides such as job displacement, environmental concerns, and labor rights violations.",1.0,0.0,1.0,0.0,0.0,0.0,0.0
1449,"Efforts to address the obesity epidemic include promoting healthier food choices, increasing physical activity, regulating the food industry, and implementing public health campaigns.",0.0,0.0,0.0,0.0,0.0,1.0,1.0
1450,"Debates around the legalization of marijuana often involve discussions about potential medical benefits, economic opportunities, public health implications, and concerns related to addiction and crime.",1.0,0.0,1.0,0.0,0.0,0.0,0.0
1451,"Discussions about the impact of remote work on society explore potential benefits, such as reduced commute times, increased work-life balance, and cost savings, while also addressing potential drawbacks, including social isolation, communication challenges, and decreased collaboration.",0.0,0.0,1.0,0.0,0.0,0.0,0.0
1452,"Efforts to address climate change involve reducing greenhouse gas emissions, investing in renewable energy, implementing carbon pricing mechanisms, and supporting climate adaptation initiatives.",0.0,0.0,0.0,0.0,0.0,1.0,0.0
1453,"Debates around the role of the gig economy in modern society often focus on job flexibility, entrepreneurship, worker exploitation, and the need for updated labor laws.",1.0,0.0,1.0,0.0,0.0,0.0,1.0
1454,"Discussions on the impact of deforestation often highlight the loss of biodiversity, climate change implications, soil erosion, and displacement of indigenous communities, while also considering the economic benefits of land development and resource extraction.",0.0,0.0,1.0,0.0,0.0,0.0,0.0
1455,"Efforts to combat the spread of misinformation online involve promoting digital literacy, implementing fact-checking initiatives, regulating social media platforms, and encouraging responsible journalism.",0.0,0.0,0.0,0.0,0.0,1.0,1.0
1456,"Debates surrounding the legalization of assisted suicide often involve ethical considerations, individual autonomy, the potential for abuse or coercion, and the role of medical professionals.",1.0,0.0,1.0,0.0,0.0,0.0,0.0
1457,"Discussions on the potential benefits and drawbacks of universal basic income include addressing income inequality, automation-related job displacement, economic growth, and concerns about disincentives to work and the cost of implementation.",1.0,0.0,1.0,0.0,0.0,0.0,0.0
1458,"Efforts to promote sustainable agriculture involve encouraging organic farming practices, reducing food waste, supporting local food systems, and implementing policies to protect ecosystems and biodiversity.",0.0,0.0,0.0,0.0,0.0,1.0,1.0
1459,"Debates about the role of surveillance technology in public spaces often focus on security benefits, crime prevention, privacy concerns, and potential misuse by government agencies.",1.0,0.0,1.0,0.0,0.0,0.0,1.0
1460,"Discussions surrounding the pros and cons of nuclear energy include debates on its potential for reducing greenhouse gas emissions, concerns about nuclear accidents, radioactive waste management, and the high costs of construction and decommissioning.",0.0,0.0,1.0,0.0,0.0,0.0,0.0
1461,"Efforts to address the rising cost of higher education involve promoting affordable tuition policies, increasing access to financial aid, advocating for free college programs, and exploring alternative education pathways.",0.0,0.0,0.0,0.0,0.0,1.0,0.0
1462,"Debates around the potential benefits and risks of genetically modified organisms (GMOs) often involve discussions on increased agricultural productivity, resistance to pests and diseases, potential environmental impacts, and concerns about long-term health effects.",1.0,0.0,1.0,0.0,0.0,0.0,1.0
1463,"Discussions on the impact of social media on mental health often explore potential benefits, such as social connection and information sharing, while also addressing potential drawbacks, including cyberbullying, addiction, and body image concerns.",0.0,0.0,1.0,0.0,0.0,0.0,0.0
1464,"Efforts to reduce gender-based violence involve promoting public awareness campaigns, implementing stricter legal penalties, providing support services to survivors, and addressing harmful cultural norms.",0.0,0.0,0.0,0.0,0.0,1.0,0.0
1465,"Debates surrounding the privatization of public services often focus on potential cost savings, increased efficiency, concerns about the erosion of public accountability, and the potential for profit-driven motives to compromise service quality.",1.0,0.0,1.0,0.0,0.0,0.0,1.0
1466,"Discussions around the use of alternative energy sources often explore the benefits of solar, wind, and hydroelectric power while considering the challenges of energy storage, grid integration, and fluctuating generation capacity.",0.0,0.0,1.0,0.0,0.0,0.0,0.0
1467,"Efforts to address affordable housing shortages include promoting rent control policies, increasing funding for public housing, supporting nonprofit housing initiatives, and encouraging the development of mixed-income communities.",0.0,0.0,0.0,0.0,0.0,1.0,0.0
1468,"Debates about the ethics of animal testing for medical research involve weighing the potential benefits for human health against concerns for animal welfare, alternative research methods, and the applicability of animal-derived data to human diseases.",1.0,0.0,1.0,0.0,0.0,0.0,0.0
1469,"Discussions around the importance of vaccination highlight the benefits of herd immunity, the prevention of infectious diseases, potential side effects, and concerns about personal choice and medical freedom.",0.0,0.0,1.0,0.0,0.0,0.0,1.0
1470,"Efforts to reduce plastic waste in the environment involve promoting reusable products, implementing plastic bag bans, advocating for plastic recycling programs, and encouraging corporate responsibility in waste management.",0.0,0.0,0.0,0.0,0.0,1.0,1.0
1471,"Debates around the merits and drawbacks of a single-payer healthcare system often explore potential benefits, such as increased access to care, cost savings, and streamlined administration, while also considering potential drawbacks, including increased taxes, wait times, and concerns about government control.",1.0,0.0,1.0,0.0,0.0,0.0,0.0
1472,"Discussions on the impact of globalization on society often involve examining economic growth, access to new markets, cultural exchange, concerns about job displacement, income inequality, and the environment.",1.0,0.0,1.0,0.0,0.0,0.0,0.0
1473,"Efforts to address the digital divide include expanding broadband access, increasing the availability of affordable devices, promoting digital literacy, and advocating for equitable access to technology and digital resources.",0.0,0.0,0.0,0.0,0.0,1.0,0.0
1474,"Debates surrounding the role of the media in shaping public opinion often focus on journalistic ethics, the potential for sensationalism, the influence of corporate interests, and the importance of balanced reporting.",1.0,0.0,1.0,0.0,0.0,0.0,1.0
1475,"Discussions about the impact of cultural diversity on society often explore potential benefits, such as increased creativity, innovation, and social cohesion, while also addressing potential challenges, including communication barriers and the potential for social tensions.",0.0,0.0,1.0,0.0,0.0,0.0,0.0
1476,"Efforts to combat childhood obesity involve promoting healthy eating habits, encouraging physical activity, implementing school-based nutrition programs, and advocating for policies to restrict the marketing of unhealthy foods to children.",0.0,0.0,0.0,0.0,0.0,1.0,1.0
1477,"Debates around the regulation of cryptocurrencies often focus on the potential for financial innovation, increased access to banking services, concerns about illegal activities, and the need for consumer protection and stability.",1.0,0.0,1.0,0.0,0.0,0.0,0.0
1478,The CEO announced that the company's new initiative will bring thousands of jobs to the community.,0.0,0.0,0.0,0.0,0.0,0.0,1.0
1479,Climate change is a hoax perpetuated by liberal elites to undermine our nation's economic growth.,1.0,1.0,0.0,0.0,0.0,0.0,0.0
1480,"Both sides of the vaccination debate have valid concerns, and it's important to consider all perspectives.",0.0,0.0,1.0,0.0,0.0,0.0,0.0
1481,"Minorities continue to struggle in low-income neighborhoods, while the white majority enjoys the benefits of gentrification.",0.0,0.0,0.0,0.0,1.0,0.0,0.0
1482,"The recent tax cut was only beneficial to the wealthy, proving that the government caters to the rich.",1.0,1.0,0.0,0.0,1.0,0.0,0.0
1483,Experts agree that the best approach to tackling the obesity epidemic is implementing a sugar tax.,1.0,0.0,0.0,1.0,0.0,1.0,0.0
1484,The pharmaceutical industry has a long history of prioritizing profits over public health.,0.0,0.0,0.0,0.0,0.0,0.0,1.0
1485,Many women are choosing to freeze their eggs due to the increasing demands of their careers.,0.0,0.0,0.0,0.0,1.0,0.0,0.0
1486,"Climate change is a pressing issue, and we need immediate action to prevent further environmental damage.",0.0,0.0,0.0,0.0,0.0,0.0,0.0
1487,The senator's proposal to increase funding for public schools is just another socialist scheme.,1.0,1.0,0.0,0.0,0.0,0.0,0.0
1488,Gun control laws only infringe on the rights of law-abiding citizens.,1.0,1.0,0.0,0.0,0.0,0.0,0.0
1489,Both supporters and critics of the new immigration policy have valid points.,0.0,0.0,1.0,0.0,0.0,0.0,0.0
1490,"The vegan lifestyle is a fad that will soon lose popularity, as people realize the nutritional deficiencies it causes.",1.0,0.0,0.0,0.0,0.0,1.0,0.0
1491,"The fast-food industry targets low-income communities with unhealthy, cheap food options.",0.0,0.0,0.0,0.0,1.0,0.0,1.0
1492,Research suggests that the gender pay gap is a result of women's career choices.,0.0,0.0,0.0,0.0,1.0,0.0,0.0
1493,The increase in crime rates can be directly linked to the decline in traditional family values.,1.0,1.0,0.0,0.0,0.0,0.0,0.0
1494,Tech giants like Facebook and Google hold a concerning amount of power and influence over our lives.,0.0,0.0,0.0,0.0,0.0,0.0,1.0
1495,Renewable energy sources will never be able to replace the reliability and efficiency of fossil fuels.,1.0,1.0,0.0,0.0,0.0,0.0,0.0
1496,Both proponents and opponents of the minimum wage increase argue that their position will benefit the economy.,0.0,0.0,1.0,0.0,0.0,0.0,0.0
1497,The advertising industry perpetuates harmful stereotypes that negatively impact society.,0.0,0.0,0.0,0.0,0.0,0.0,1.0
1498,"Unemployment rates are at an all-time low, thanks to the president's economic policies.",1.0,1.0,0.0,0.0,0.0,0.0,0.0
1499,"Despite the growing popularity of plant-based diets, meat consumption continues to be a crucial part of human nutrition.",0.0,0.0,0.0,0.0,0.0,1.0,0.0
1500,"Many news outlets claim to be unbiased, but their coverage often reveals a clear political slant.",1.0,1.0,0.0,0.0,0.0,0.0,0.0
1501,"High-ranking officials from both major political parties have expressed support for the new infrastructure bill, despite the ongoing debate on certain aspects of the proposal.",0.0,0.0,1.0,0.0,0.0,0.0,0.0
1502,"As a result of ongoing gentrification, local businesses in historically low-income neighborhoods are being forced to close their doors due to increased rent prices and shifting consumer demands, further widening the economic gap between the rich and poor.",0.0,0.0,0.0,0.0,1.0,0.0,0.0
